sentiment,text,data_id
positive,"This is a great stove hood, very quiet, easy to install and a nice update to a kitchen.  The price on Amazon was lower than any big box store for this quality.",71
negative,I love the ice machine I have 1 at my home and 1 in my office. I bought this in May of this year and did not have any problems with it until now. All of a sudden it started to make this loud really loud sound when automatically filling the water into the dish. SMH I can't believe this has started to malfunction already.,71
positive,Good Quality product and was as advertised.  Will be buying more when needed.  Like using my own coffee.<br /><br />Would Recommend to family and friends.,71
positive,"This dryer vent hose was super easy to install. The price was great. Our vent hoses, in the past, would get very warm on the outside, when using the dryer a lot, but not this one. I don't think using the dryer in the summer is going to heat up the house as much as it did with other vent hoses.",71
positive,"My first failed after 3 years. Replaced it with a cheap clone, lasted 1 week. The Amazon one is a new upgraded model with a guarantee. Price with Prime beat most new ones on the net.  It arrived a day earlier than expected, and took about 10 min to install in the hole left by the failed one.  It has been working fine for a year now, that's great!",71
positive,great price for basically the same samsung product!,71
positive,Easy to install an the water and ice cubes taste good,71
positive,I am loving my new coffee filter! Saving so much on using my own coffee blends instead of using the kcups. Very easy to clean and use. I’ve tested the amount of coffee grinds to put in and amount of water. I found the perfect combo and made my perfect cup! Received as described. Fast shipping. Worth the amount I paid.,71
positive,"Works great, fast shipping, and great price!!",71
positive,Saved $100 service call and was easy DIY,71
negative,It fits just like the original but after 5 weeks the seal has come loose and needs put back In place each tile the filter is cleaned. See picture,71
positive,Received without hardware so had to go locally and purchase new item to complete the job.,71
positive,This product works,71
positive,Great kit for at home baristas! The stencils are cute for easily little decorations and the froth pitcher works great for making latte art at home.,71
positive,works great,71
positive,"It took a few spilled cups of coffee to get it right. However I found that if you rinse, not wash the pod, the brewed cup becomes more flavorful. (I am guessing the filter screen over time becomes less passive & allows a slower deeper brew). I use 3 scoops of dark Italian roast, and the flavor/taste is equal to the store bought disposable k cups.",71
positive,"I would prefer magnets for adherence versus adhesive, but I added my own and it's great.",71
positive,"This filter fits our refrigerator just fine, and doesn't leak. The water flow is significantly faster than with the name brand filter. I've read this means the filter isn't working as well, but I can't taste a difference in the water. Packaging and product arrived as expected.",71
positive,"These oem parts came quickly, were easy to install and took care of the banging problem.",71
positive,Easy to clean and heat resistant.,71
positive,Easy to use and perfect fit. No residue from reusable k cup anymore with these filters.,71
positive,Great to use with your  Keurig machine.,71
positive,The first oven I received the glass was broken in front door. Oven was replaced within a week. A part was missing that holds up the rotisserie on one end. I will finish my review when I see how much trouble it's going to be to get the part that was missing from the oven.,71
positive,It makes the coffee taste better.,71
positive,We watched a video on youtube to repair our dryer with these parts. We used all of the parts so that we will not have to do it again for a long time. It was so easy and now my squeeky dryer is fixed.,71
positive,Pense que no me llego pero lo habian dejado en otro business pero ya lo twngo a Mano muy utilizable,71
positive,These work great - no grounds in the coffee,71
positive,worked good,71
positive,Good,71
positive,Perfect!  Installed in 10 minutes. Nothing but ice.,71
negative,This was to short for my stove. It didn't fit.,71
positive,"Repair for my kitchen range.  The serial # is different and looks different than the original, but don't let this sway you it fits perfect.",71
positive,"Been looking for Bosch filters for a while, which aren't stocked at Home Depot or Best Buy. These connected right in, and worked great.",71
positive,Easy to put on and install works good and durable,71
negative,I just got it. Can't say much yet.,71
negative,la calidad es pobre unos dias de uso la pintura del centro con el calor esta cayendose,71
positive,Replaced previous fuse in the clothes dryer.<br />Works perfectly. Thanks for prompt delivery.,71
positive,Purchased as a replacement for one that was worn out...after fifteen years. It works...as advertlised....AND...came with a ferrel and new connector nut. Read reviews where some vendors do not supply the ferrel and new brass nut....which is required. You will need a small copper tube cutter to remove to old ferrel.,71
positive,"The kit worked exactly as advertised.  The front bearing and felt were easy to install, just watch the youtube video.  Even though I didn't need to, I also replaced the rear bearing that comes with the kit.  This was harder to replace, particularly centering the drum on the bearing from the front with no visibility.  Took about 20 minutes to get the center axle onto the bearing, after that it was straightforward to re-assemble the dryer.<br />Works great now, and is much quieter.",71
positive,"Neighbors fridge went out, after some YouTube found out it was the board, most places wanted twice as much with 2-3 day shipping. I received the board about 24 hours after buying , it was an exact match and save my neighbor a bunch of money not having to restock her fridge.",71
positive,THESE DO ALLOW YOU TO BREW ANY K-CUP ON MY TYPE 2 KEURIG COFFEE MAKER BUT INTERFER WITH THE REUSABLE K-CUPS AND ARE DAMAGED.,71
positive,I like that it is easy to install and lasts a long time instead of six months. the water tastes great and I can recomend it to anyone.,71
positive,Good product. Well.made,71
positive,"Large, easy to understand green and red lettering. Sticks to my stainless dishwasher like glue, using the magnet. Love it.",71
positive,Love the cost of the product.  Will purchase for my home as well.,71
negative,Horrible product and customer service. Doesn't cool properly and the back stays a block of ice. Customer service is of no service and says to manually defrost it often. Who wants to do that. DO NOT BUY THIS PRODUCT.,71
positive,Great Value!!!,71
positive,Fit the dryer like it said it would. I just had to figure out a way to trick my husband into changing it for me.,71
positive,"I bought this filter because I really enjoy drinking my Dunkin Donuts coffee. This was before they had the DD k-cups. But this filter does the job. Just fill it up with your favorite ground coffee, brew and enjoy!",71
negative,"I'm not sure the exact problem, but the water comes out a lot faster and is very loud (coming from back where water comes in). Even my kids asked right away what was wrong with it.  It is as if the water is not going through the filter at all. The water tastes that way too. It went in easy.  Tried reinstalling.  I ended up ordering the Samsung version.",71
positive,"So happy I was finally able to find a reasonably priced freezer! This arrived earlier than originally expected and was delivered early in the morning. I was pleasantly surprised to find it had been brought up the three steps to my door so that it was easier for me to get in the house. Unpacking was easy and setup was as simple as removing some tape and plugging it in. Within a couple of hours, it was cold enough for me to start using.<br /><br />This was bought so I had some additional storage space as I have a side by side fridge/freezer that I hate and the size is perfect!",71
positive,Cheap and reliable filter.,71
positive,Watched a you tube video on how to install. It was easy to do and the freezer started to seal again. I am super pleased with the results,71
negative,"I hate this stinking stove. We got one eight months ago and it's been nothing but a pathetic peace of crap almost the entire time. It worked great ONCE, now the oven keeps shutting itself either off, or drops the temperature back to 300F It takes almost an hour to come to 450F for bread baking, and as soon as you open the door it drops to 300F. The top is a nightmare to clean and VERY susceptible to scratches, and with the trouble I've read here and elsewhere about the self cleaning oven catching fire, I don't want to even attempt trying it. I had a bad feeling about the stove when it first arrived, no manual, no, broiler pan and one of the adjustable feet were missing. Sears, always good about making things right, replace the foot, but no broiler pan, and Samsung, even though they said they would send one, haven't, and we had to download a version of the owners manual. Sears is coming out in three days, I hope to get this hauled out of my house for something better. Stay away from this POS. I gave it one star because there no option for no stars.",71
positive,Great price! It’s a generic for my Frigidaire gallery gas stove. Manufacturers replacement was $125 yikes!,71
positive,Love this product! My fat belly keeps hitting the controls installing a fire.,71
positive,"Took a pic, replaced wires 1 at a time and I was done in 15 min or less. Actually took longer to pull out the range and  open the back than it did to replace the switches. Stove heats up fast again and works like new!",71
positive,[[VIDEOID:ed086151442b3b3e87dc7ba683c911eb]] I use to have to wipe down my refrigerator at least twice a day these are such a life saver will be ordering on other pair.,71
negative,"Purchased one a year ago and just as the warranty expired the product stopped working. This is the third one I purchased from this manufacturer. This last one stop working, but I have extended warranty. Sending a my money back gonna have to buy another one.",71
negative,"Not what is pictured. With some work and using some of the old parts, I was able modify the old parts, adjust the door and a few trial and errors, I was able to make 1 piece in the package work.",71
negative,"Be aware: this product doesn't filter ANSI/NSF 53 impurities like mercury, lead, and other toxins. It only meets ANSI/NSF 42, which just makes water taste good.<br /><br />The actual Samsung replacement filters sold at Lowes, which is a retailer of Samsung refrigerators, meets both standards and are DA29-00003G. I bought one two weeks ago and installed it. It works fine.",71
positive,I needed to replace the broken vent flap so ordered this new one.  I learned by doing this because I found I had to buy a reducer tube so the new tube can fit into it.  But that was very inexpensive and at the local hardware store.  Had to buy the special silver tape because duct tape will melt and get gummy.  I was able to get the job done quickly and felt pretty good that I didn't have to beg the man next door to help me with something again!,71
positive,Loved the speed and accuracy of our dryer part. We had just returned from vacation to our dryer not working. Our part arrived the next day. Crisis averted! Thanks guys! Will order with you again!,71
negative,"The description to this product says it works for refrigerator models WRX735SDBM02….I have a Whirlpool WRX735SDBM02 and this filter does NOT work.  It fits perfectly, but no ice is made and water comes out basically at a fast drip.  Terrible product and falsely described. Do NOT buy from these people.  They are dishonest.",71
positive,The igniter works great for my oven.  I bought an extra for standby too.,71
positive,"I was a bit skeptical when my wife found these replacement wheels online - they attach differently than the original ones, but they fit and perform perfectly - sturdier than the original ones!",71
positive,Everything was on par with OEM.  Might have to cut a small rectangular notch in the bigger thermostat for the oem temp probe if you have a small onboard probe like mine,71
positive,Product worked perfectly and saved me over 200.00,71
positive,The product was as described and they fit perfectly. Worth the cost.,71
negative,"Color fadeaway with the heat, the original gray is better",71
positive,"Nine ice cubes in 6 minutes!  Two sizes of cubes.  The small size is pretty dinky.  Don't know what to do with them.  The larger size is just right for most drinks.  It's fun to watch the process.  The cubes drop into a basket where you can scoop them out to go into your freezer.  Best to scoop out each batch as they fall since the basket is not refrigerated.  We are using this unit in our RV to avoid having to buy bags of ice that won't fit in our small freezer.  This way, we can make only the amount we need and have room for.  Very quiet while running.",71
positive,This is the 3rd or 4th one we have ordered. Comes fast and more economical than from LG directly.,71
positive,"Work great in my fridge, here they are half the cost from Sears.",71
positive,Haven’t really had time to use it...,71
positive,"Good price, easy to install",71
positive,"[[VIDEOID:91e128f4f0370da9b7950ecd3f0f5e4]] Love it so much, better then using the ones at my apartment. I bought a little stand to stand it next to my tub to drain. I use my shower hose to fill it up or I use a pitcher because its faster. Now I can take my time on laundry and not have to worry about my neighbors.",71
positive,Fits and works great.,71
negative,"This did not work with my keurig machine. With both containers I received an oops err, not a keurig product and cannot be used.",71
positive,"Great product, great tasting water!",71
positive,went in easy and did not leak,71
positive,my original bin broke. The new one fit perfectly in my Kenmore refrigerator!,71
positive,"We have a front load washer that is getting up in age.  We had done many troubleshooting and everything we tried was a bust.  So, as a last resort I ordered these.  It was kind of hard to put them on but not because of the product.  Just because you have to get under your washer and ours doesn't have much room to move.  Ran a few load of wash on a normal spin and it didn't move at all!  Very worth the price, and hopefully it is our fix for a while!",71
positive,"My headline says it all, sturdy but keeps eggs fresh and handy",71
positive,I have had mine for over a year and it is still going strong. very easy to use.,71
positive,"The lid will pop off.  The material is flimsy, so be careful not to break when replacing lid.  The 24k aspect does not improve the taste of the coffee.<br /><br />Do not overfill with coffee granules, otherwise when the water flows through it will cause the lid to open then your machine will malfunction.  To place this pod in your pod holder, slide down to open it wider, then place this pod into slot.  Works fine.",71
positive,"An exact replacement brand name item is what I was looking for, at a reasonable price. This satisfied my needs completely.",71
positive,"You have to suck it up and purchase those little annoying things like range hood filters…you can only wash the originals so many times..  not easy to find…if I were mfg. I’d market better. Nicely made,  packed very well to prevent bending in mail.<br />Arrived fast too",71
negative,they keep snapping the clips,71
positive,I’m like this product really good easy to use and clean.,71
positive,"After reading the reviews, I decided to try these, since I wasn't too thrilled with either the cost or quality of the senseo pods. After getting my three sets in the mail, I went to my grocery store, bought the Starbucks Sumatra whole beans, ground them to expresso grind, and went to try the ecopads. I followed the instructions, put the ecopad in the machine (perfect fit), hit the 8oz button, and wa - la! I would challenge anyone to tell the difference between the stuff you pay $3.50 a cup for at Starbucks. I'm definately hooked. I can't see how other reviewers have had problems with these. They are easy to fill, and fit perfectly in the machine. They are a bit messy to clean up, but its a fair trade off for the awesome coffee and the cost savings over the pods or actually going to starbucks. I would estimate I will get 50-60 cups out of a $6 store bought bag of coffee. Basically, one heaping teaspoon fills up the ecopad perfectly. Also I would estimate getting hundreds of uses out of each ecopad - they seem very durable. I am looking forward to trying different coffee's with these. Well worth the tiny investment!",71
positive,Good product and fast delivery.,71
positive,Item as expected.,71
positive,It is fast and we love it!,71
positive,"While on vacation, the ice maker in the rental broke down. This keep us going! I also love having it at home as a backup. It is fast, easy to use, and produces edible ice!",71
positive,"This is the easiest-to-install filter I’ve ever had, and I put it on an automatic delivery as recommended by Electrolux so I’ll always have the filtered water I want. I pour a pot out for coffee, and for my irons. The best part - fresh water with no wasteful plastic bottles! Use your own refillable containers.",71
negative,This product did not work at all.  Returned.,71
positive,Awesome device easy to use and accurate.,71
positive,Has stopped the washing machine from moving,71
positive,"Works great and water taste great, have like a strong sulfur smell with our tap water and this completely gets rid of it.",71
negative,These are the replacements recommended by LG. They fit perfectly and at a good price,71
negative,"Easy to install, good price if it didn't only last 3 months",71
positive,just what i ordered and at a very reasonable price.  thanks dpage,71
negative,Returned this because it was suggested as being similar to the Frigidaire that I needed but it wasn’t even close.,71
negative,"We bought a stainless steel, built-in KitchenAid dishwasher about two years ago when we were renovating our kitchen. It has been a huge disappointment ever since. It doesn't actually clean the dishes, no matter what setting we have it on. It leaves bits of food and random stuff on everything. It smells like rotten eggs when it runs. Plus, it runs for hours and hours -- why? It does not effectively dry the dishes. We have had it serviced at least three times with no real improvement. Really, at this point, it is just a glorified dishrack and we end up washing almost everything by hand. Cost over $500 and is worse than the $200 dishwasher we had before. Don't buy, unless you just secretly want a fancy, stylish dishrack.",71
positive,This egg holder is sturdy and I love the color. I also like that it comes with a removable lid allowing me to place items on top when the fridge is full.,71
negative,"We received and used this today.  Upshot:  for us it will usually be better to handwash in the tub till we get a plumbing revision and replace our old washer and drier, BUT this should still be very handy for loads that are quite dirty, so it will serve a purpose, and it should be handy during droughts.  The good:  the tub itself is well made.  The bad:  the support rails are not well made.  The ugly:  those rails again.  Cheap:  the rails, the suction cups, and the cost which is about four dozen dollars currently.  The &#34;undirty&#34;:  fifty cranks of a pair of jeans and a light top with about<br />a gallon of water and a tiny bit of liquid detergent came very clean.  So, for some who need a low water, small space solution this is going to be a real win.  But it has no other benefits or differences over hand washing, so those with a tub will not need it though it can be handy if you have some dirty loads that you woukd rather not do in a tub.",71
positive,Happy to report that the bulbs work on both high and low settings in my LG over-the-range microwave.,71
negative,"The plastic surrounding the metal prongs did not match the item’s picture and therefore wouldn’t fit the wiring connector in the washer. Instead of waiting two more days without a washer, I modified the wiring connector to fit since the capacitor size was correct but it should have been a much simpler fix. The pictured capacitor would have fit perfectly as the item number is listed as compatible for my washer.",71
negative,So I have 3 digital thermometers and they all read different. Recalibration options would make this a 5 star product....oh well. :-(,71
positive,Fit right in; very easy to install. Working well,71
positive,These are good filters. Works very well.,71
positive,Way cheaper than buying a whole new dryer!,71
negative,"[[VIDEOID:c80acbda0af668e25714e6cac5d6b2ad]] UPDATE:<br />I was very positive on my original review.  After 3 months, my dryer stopped spinning.  Opened it up to find a frayed drive belt and a pile of belt dust on top of the motor - see photos.  Of course, this is beyond the return period and I need to spend another Saturday fixing the dryer!  So much for the parts ""appearing"" to be of good quality!<br /><br />=====================<br />My 12-year old LG dryer was squealing, and after much internet searching, it sounded like I needed a new pully.  This full kit was available for less than $40 with next day delivery, and I thought I'd just replace everything since I'd be in the machine and wasn't sure the condition of the other parts.  Took me a few hours and in the end, the sound remains.  All parts in this kit appear to be of good quality, it just didn't work for me.",71
positive,Exactly what we needed to get the heat back in our dryer.,71
positive,Exactly what we needed!,71
positive,I'm very pleased with my new filters. They are slightly larger than the original so I'm not experiencing any grounds in my coffee. A great product at a great price.,71
positive,It works and fits well.,71
negative,"I had high hopes for this product, but both sizes let too much sediment through (smaller pore one is better though). Switched back to using the original filter paper.",71
positive,Good product!! Had some scratches in ceramic paint on corners...,71
positive,Easy to use and does not take up much space,71
positive,Very easy to install. It was the right description. Great price. Will buy more!,71
positive,I love this freezer.  The black color is very sleek. The bin and shelves make organizing easy.,71
positive,work great!,71
positive,These strainers are perfect for brewing loose teas for either a pot of hot tea or a pitcher of iced tea and the cleanup is quick and easy!,71
positive,First one came broke but sent another asap works great!,71
positive,Nice,71
positive,"Sleek, glass adds a nice touch. Matches our appliances great.",71
positive,Like that it help protect your stove and it’s easy to clean but it comes with no instructions on how to install that can be challenging for most,71
negative,Looked used.,71
positive,It was a perfect fit and simple to install,71
negative,Smaller than original. Cheaper plastic but gets the job done.,71
positive,It was what I needed for my new Keurig and the filters I had left from my old taller water filter fit the new shorter one.,71
positive,Great product,71
positive,This is a value! It’s easy to put on and take off. I’d buy again,71
positive,I love the panda. keeps my white tops white and my black tops lint free.Great for the babys wash all of it. This little washer gets my<br />wash cleaner then my large kenmore. The spin dryer works well for me cause I dont dry most of my things anyway. But comes out<br /> much dryer then my large washer last spin. Hang and with the fan you can dry in about 1 hour. BUY IT.,71
positive,Mfg. part supplied.Eexact fit & function. Fast Delivery.,71
positive,"worked like a charm on my Samsung dryer DV328AEW/XAA. It rang up 9.5 ohms on the multimeter and that's the ballpark number to expect per some videos on the youtube. I am not at all a handy person and this is the first appliance that I opened up and fixed myself. So, am quite happy that it worked out without any issues (other than some initial burning smell which did not totally surprise me as it came just out of the box and I had my dryer vent open when I switched it on).",71
positive,Was not an exact match to the whirlpool valve but worked perfectly just the same.,71
positive,"First, we did not get this as a promotion for my review and second, I rarely write reviews. It arrived on time and in perfect condition despite what other reviewers said. We plugged it in and within no time it was perfectly cold. We bought this because our old beverage fridge died and didn't want to pay to get it fixed plus it only got down to 41 degrees which was not cold. We wanted cold beers and pop and this advertised to get down to 32 degrees. It far exceeded our expectation because at the highest setting it got down to 29 degrees with nothing in it. Its the perfect size and looks beautiful too. There's plenty of shelf adjustments depending on what u want to put in there and I love the light. Its bright enough so u can see inside at night. We couldn't be happier! Finally someone made a fridge that gets super cold and for a really good price without having to buy a commercial fridge",71
