sentiment,text,data_id
positive,I like that I have plenty of these filters on hand and they will last me a very long time.  I no longer have to worry about running out and trying to find them in the store.,71
positive,Fantastic product. So much cheaper than ordering from GE and works perfectly. Very pleased,71
positive,"Exactly what I needed. Great price, and worked immediately. Hopefully it works for several years more to come.",71
positive,"Purchased a Samsung Dryer Belt Kit with Drum Rollers, Heater Element, and Thermostat Sensor Kit. Everything<br /> needed for a complete dryer Overhaul.  All Part replacement fit like glove. Hoping that my Samsung dryer will last another 10 Years.",71
positive,"The filter was easy to install, reasonably priced, and compatible with our Kenmore frig. A good deal!",71
negative,Fits well but very thin. Stained easily. One spillover and it stained. No scrubbing cleaned it. Perhaps oven cleaner. Haven’t tried.,71
negative,"The 1 year warranty is about as good as no warranty at all.<br /><br />They reserve the right to repair rather than replace, with used parts no less and based on my interpretation of this warranty, the customer is responsible for attempting to troubleshoot problems, pack up and ship the item out for repair....all at the customer’s expense. Can you imagine the cost to ship both ways? I wouldn’t be surprised if that far exceeded the cost of a new unit....just awful.",71
positive,Works well with my refrigerator,71
positive,Work great,71
positive,Easy to install and is working great today but how long will it last? If it lasts 3+ years I will be one happy customer.,71
negative,The image displayed for the product shows the unit wired with the red and white wires however the part shipped to me was not wired nor were there any wires in the box. Unable to repair dryer without this part being wired as displayed in product image.<br /><br />Currently pending return approval,71
negative,Instruction pictures were blurry. Had to google how to put it together,71
positive,"Fit perfectly, heats up better/ faster than the original. make sure to measure the length of the leads past the mounting plate.",71
negative,"Constantly runs, followed all manufacturers install guidelines. Won't keep temp",71
positive,Worked perfectly for my customers oven repair,71
positive,very good,71
positive,this is all it took to fix my dishwasher just like new again,71
positive,"We love having ice quickly, since our ice maker in our freezer broke. You do need to transfer once the ice is made into a freezer otherwise it melts.  The ice is great!  I recommend having an ice pic handy to keep in freezer for breaking ice up, it does tend to stick together. Update, it died before we hit 1 year, we used it regularly.  We tried to get it up and running but no such luck. Unfortunately now I have to change my 5 star review to a 2. I’m now shopping for a new ice maker.",71
negative,"If your not careful reading this headline, it's easy to think you might be getting 3 of these filters, instead, you just get 1.  You can find other offers that have 3 for $49",71
positive,Was the exact part and did the job.,71
positive,Quick Shipping. Very happy.,71
positive,Good,71
positive,Works great..taste as good as the oem product can't tell the difference.,71
positive,Exactly what I wanted.,71
positive,The value couldn’t be beat.,71
positive,These pods work very well.,71
positive,Product received as described and installed without a problem.,71
positive,To filter my coffee,71
positive,"Easy to use, come off easy to reuse capsule again.",71
negative,"Just as a heads up,the Red Finum Brewing Large Basket,is not Red.<br />I wanted the Red one, when I received it, the outside of the box had a Red dot on it for the color.<br />When I opened it,the color was Brown.  Amazon sent me a replacement, same thing again, Brown, not even a Burgundy, but Brown.  I am returning them for a Black one, so I have not been able to use it yet, hence only a 2 Star rating.  I am sure that the product will be good, once I receive the right color.",71
positive,The first one went faulty but she loved it enough to get another.  I guess that says enough about it.  I haven't learned to use it.,71
positive,"great idea, seems simple, only concern is the adhesive being used (toxic?)  I don't know but I  would recommend using fire resistant cement,",71
positive,Fits just the same as the Samsung filters.  Will get them again when these are used up.,71
positive,Really looks great on the appliances in my kitchen. I really like that these covers can be washed. Great buy but I think the price is a bit high.,71
positive,Good,71
positive,"very good, very good",71
negative,"The solenoid valves did not line up with the OEM wiring harness, making installation a PITA!!!!",71
positive,"Excellent product for the money, performance is the same as the original Samsung filter after water test, basically you get three filters for the price of one original.",71
positive,used before,71
positive,"Perfect snug fit. Good value, good product. Product feels sturdy and reliable and so far has worked phenomenally, will definitely purchase again in the future.",71
positive,Perfect fit in my refrigerator. Very happy with purchase,71
positive,Better quality than OEM screen.,71
negative,"This refrigerator either freezes everything in it, or doesn't keep it cool enough, spoiling everything in it. The temperature controls are extremes making this refrigerator useless.",71
positive,Fast delivery. Product delivered as described,71
positive,"Worked as expected, good quality.",71
positive,"Handy, keeps the fine coffee grounds in the filter.  The flip over top secures the grounds in very well.  5*",71
positive,Fills a gap in my life - well between my stove and counter anyway....,71
positive,No issues,71
positive,"What a pleasure to have to do my dishes overnight .<br />  I am  primary/only caregiver to an 87y/o<br />gentleman with a new heart valve (April 2014), advanced AMD ,and severe arthritis in knees and rt hip...I run from 7am until 1130-12 pm...and used to do the dishes before collapsing into my bed..No more..<br />  This little beauty has given me a wonderful treat each night I plug him in..<br />(GARY COOPER is his name)..chuckle ..go ahead!!no problems with cord, hose, or noise..<br />No bad odors..use Cascade packets and the energy saver setting..ABSOLUTELY MARVELOUS MY DARLING FRIDGIDAIRE!! Dgbr",71
negative,Wrong belt for my whirlpool dryer.,71
positive,Was a perfect fit and works great,71
positive,Good fit. This is the first time I use this product and so far so good.,71
positive,So far so good,71
positive,"I only needed a single roller wheel, but it's cheaper overall to buy a full kit like this. Previously I've replace the heating element (twice) and the drive pulley on my machine. With these parts, I should be able to keep the 10 year-old-plus dryer going another ten years or more. (I've taken it apart so many times, some of the sheet metal screw holes are starting to strip.)<br />The drum wheels seem of a quality similar to the original parts.",71
positive,"Good bag, I've had it a while, replaced a heavier bag, but this one is holding up.  It's a soft bag, so careful how to lay your burner down or you'll break the control knobs.",71
negative,Poor quality. Top broke off even prior to use,71
positive,Good item. good seller,71
positive,"Easy to install, water filter does what it is supposed to do, good tasting water",71
positive,it was easily to install and it has been working for three months.,71
positive,Perfect for cleaning under my refrigerator and inside dryer lint trap duct.,71
positive,Seem sturdy enough and fit well. We will see how they hold up!,71
positive,Fast easy ice.,71
negative,"Shame on you! It didn't wo r k right to begin with,then quit altogether after 60 days?!!!! Where is your moral compass???!!! Some people are on fixed incomes,not that it matters to your profit!!! Junk! Junk junk and more junk with ZERO accountability!!!!",71
positive,"I mean, it's a dishwasher part, it worked.",71
positive,"We love our dishwasher, but sometimes we have more silverware than fits in it's silverware basket.  This basket solves that dilemma.  I've only used the smaller of the two basket sections, but I can easily add the extra place settings so nothing is crowded.  The basket is sturdy, handy, fits in either the upper or lower dishwasher rack, and is just what I was looking for to increase the quantity of silverware that can be washed at one time.",71
positive,Nothing's worse than running out of coffee filters. We've done this bulk buy several times and it always lasts us about a year. Great quality filters.,71
positive,Good quality silicon rubber. Great price.,71
negative,"I received these and I was so excited, I immediately put them in the dishwasher so I could get them cleaned and ready to use, little did I know they are NOT dishwasher safe. 😞 As soon as I pulled them out of the dishwasher and sat them on the counter the containers were wobbly and the lids were warped.<br />I didn’t receive any papers instructing how to clean them so I didn’t know they weren’t dishwasher safe. I went back on Amazon and read under the description to realize that they weren’t. A mistake on my part I guess for not reading the description completely when I ordered them.",71
positive,It is the best value around,71
negative,"Hello, i purchased this items to clamp a 4 inch dry duct and they are a little to big when screwed all the way down on flange. It works and holds it in place , but any bump and it may come off. we fixed it with duct tape anyways.",71
positive,Great Product! If you go to the store 1 of these go for $49.99. Getting three for this bargain price is worth ever penny!,71
positive,It's like the washing machine is new again.,71
negative,"Disappointed as I thought it was made better than this.  It appears the mesh cone is only being held together by tension.  So do I buy 2 more, one as a spare for when this happens again, or toss my jars and look for something else?",71
positive,"Water is clean, original new filter sent by Amazon. Tip, to remove cloudy residue you have to run the water atleast a gallon before drinking.",71
positive,Came on time and has worked fine since we got it. No complaints.,71
negative,Have purchased several of these and they last about a month before the drawer pops open and will not stay closed,71
negative,This ice maker is a joke. If you want to be humored buy this and watch it make funny looking ice cubs that melt before the next batch comes out.  Sent it back for a refund.,71
negative,"The handle fits, but I cannot make it stay anchored to the door.... am I doing something wrong?",71
positive,"We were required to install one as a part of our home inspection, it went in easily and was a cheap fix!",71
positive,"I bought this off CL and really like it. My w/d hookups aren't in yet, and it's saved me from going to the laundry locally. It does a good job washing and not a hassle at all to use. I'm in Arizona where the air is dry anyway, so my clothes drip dry outside in no time flat. Definitely a worthy way to do laundry on the cheap.",71
positive,Great product. Last a long time and work great,71
positive,"easy setup, noticeable fresher laundry with less detergent.  All around impressed, the blue light when active is a nice touch.  I can only imaging the negative reviews are from people setting their washer to use hot water when this only mixes ozone into the cold water.",71
positive,Great purchase.  So much cheaper than the pre-filled cups.  Easy to clean.,71
positive,Look just like the originals. TO bad they break frequently,71
positive,"Easy to order, came the next day, easy to put right in place and works just as it is suppose to, saved nearly $200 by doing it myself.",71
negative,Great idea but didn’t fit remotely.,71
positive,Got my mom's oven working the day it arrived.,71
positive,good price,71
positive,Good product.  Be very careful when pushing it onto the motor shaft as the motor shaft may come out of the motor housing and you will break a blade like i did and have to order a second one.,71
positive,Easy to use and makes brewing easier without having to use inverted methods every time.,71
negative,"had it plugged in for several days and did not work - would not run, did not cool - ended up sending it back. Disappointed.",71
positive,Washer working great,71
positive,The cover look like it is made with high quality materials. It even comes with the two gap covers that match the cover for the stove. Great product. Easy to install and easy to clean.,71
positive,Perfect and affordable replacement part for my LG washer.,71
positive,"this is the exact part I needed, it came in on time and now my wife is a happy camper. dryer works again. And changing IT OUT WAS A CINCH.",71
positive,Really easy to install. Absolutley beautiful. Excellent temperature control and a breeze to clean. Sheer perfection.,71
positive,Water filter was easy to install and everything seems to be working well. Only thing I dislike is the price .... very expensive compared to other brands.,71
negative,*worked great for a few months<br />*LEAKS enough that it has ruined my coffee bar<br />*difficult to clean<br />*Leaks water and some other type of fluid<br />DO NOT RECOMMEND!!!,71
positive,Fácil de instalar,71
positive,"I with the set came with one more short piece because my fridge has one side with spoilt handles. Still, they look great, fit well, stay on well, and keep the handles clean.",71
positive,Repair takes longer than expected but it improves the sound issue drastically.  15 year old dryer works great but one wheel was bad.  Swapped out all 4 and have the additional pieces on hand in the event the belt or pulley breaks.,71
positive,Best coffee filters I’ve every bought!!,71
positive,not much to saythey are fine fit my stove  wereVERY FAST WITH DELIVERY,71
positive,Perfect,71
negative,"I love single cup pour overs, but this one brews too weak with four drainage holes. Stick with the Melitta if you like your coffee to taste like coffee and not just water.",71
positive,Works great and he is now a brewing fool,71
positive,"I installed this kit 3 days ago and it is running quiet and working as expected. Considering the cost of this entire kit is approximately what I recently paid for 1 OEM roller only time will tell if it will hold up. Looking at it, it appears similar in quality to the original equipment. I recently made the mistake of changing just 1 bad roller with an OEM roller only to have to take everything back apart 3 weeks later when another roller went so moving forward I will never do that again. I thought the price was very good and decided to get this kit to replace al the wearable parts. I can also tell you the seller has contacted me twice since getting this to see if I had any questions or needed any help with installation. So far so good. I will try to remember to leave an update in a few months.",71
positive,Gifted,71
positive,"This ice maker is perfect for my house! It makes about 3 lbs. an hour. I learned that by adding a few ice cubes to the water reservoir helps make the ice faster being that it takes less time to get cold. Overall, this machine is the best one yet!",71
positive,Got the dryer working again Yippeeee!!!,71
positive,"Super sensitive and accurate.  With home heating costs ridiculously high, it's a great tool for monitoring the ambient temperature and adjusting accordingly. Thanks, Goabroa!!!",71
positive,These adaptors work great in the newer keurigs.,71
positive,Fits perfect and does the job,71
positive,Easy to install and so far its holding up without any issues whatsoever.,71
negative,I had the same issue other people did. This dang filter only lasted 2 weeks. Refunded it and went to Lowes!!,71
negative,Worked great for 2 weeks then adhesive wore off.. and now sometimes the keys dont unlock....,71
positive,Works well,71
positive,"This is now supported by Vera, however I have moved to openHAB and it works fine.  Even better than the Fibaro multisensors with one caveat.  The temperature readings are a little off when I use a high accuracy thermometer.  There is a setting to adjust this and once done it tracks just fine.  I also have one outside and it works just fine.  Granted it is covered and pointed towards my front door to prevent false trips.  The temperature range in my area is 20F-100F.  So far I haven't had any issues with it outside in a covered area and the motion sensor seems to work just fine, although the manual says to disable it.",71
positive,Worked perfectly and appears to be of high quality.,71
positive,I used all of the great advice that people have written in. My only problem now is the sludge in the bottom of the coffe cup which means that the coffe my husband likes is too finely ground?,71
positive,Part worked out great.,71
positive,Filters arrived on time and were as advertised.,71
negative,This product does not work. It worked for a week and afterwards it didn’t.<br />I have changed the battery also and it still doesn’t work.,71
negative,"Unable to return, slow coffee drop.  Coffee tastes of metal.",71
positive,Great Deal and Easy to Install,71
positive,"I don't understand why more hardware stores, including the big box variety, don't carry this product. It is a must have for plumbers because it will pretty much solve every dishwasher to garbage disposal connection situation there is. You can even stock up your SS clamp supply with the two clamps you don't use. The materials used are excellent and should never result in a call back.",71
positive,I purchased this filter to replace a damaged one and I just love it!  I use this for a single cup of coffee and insert it in a mug.  It's so easy to use and make a delicious cup of coffee.  It's also very easy to clean and I love the stand that comes with it.<br /><br />I highly recommend it!,71
positive,"Easy to install, so far it’s working correctly.<br />It’s a little noisier than the original pump but not too bad.<br />Hopefully it will last many years?  Time will tell.",71
negative,The bottom zone DOES NOT GO TO 44 Degrees like the website description. IT only goes to 50 degrees.,71
negative,"Tarda mucho en secarse la ropa, hasta me conviene secar la ropa en el sol",71
positive,"The belt and tensioner pulley were slightly different than the original parts, but everything fit and worked perfectly. Took about 2 hours to replace the parts. Very happy that the squeaking is gone.",71
negative,It was broken the day I got it but I missed the return window because it slipped my mind...<br /><br />It basically worked for about 6 min but made an awful metal chipping at metal sound rapidly and then it died.  I assume something broke off and got stuck in the motor or the motor was just defective or badly made,71
negative,I wouldn't recommend using a humidifier that fits these if you have hard water. Our water has lots of dissolved solids and these filters end up losing their effectiveness in about half the expected time. These just don't hold up and get hard and moldy too quick.,71
positive,These worked perfectly,71
positive,"nice upgrade from old maytag filter, flows fast",71
positive,"Purchased a while ago just for the heating element for my daughters dryer. It was easy to install, fit perfectly, and still going strong. Great value!",71
positive,"Perfect fit, great value,",71
positive,Look good ease of cleaning  Thanks,71
positive,Recibido tal como la foto,71
positive,"I was a little hesitant since this only includes the lid and not the pod, but it works. There are so many options on amazon, that I was unsure as to which one would work best, but I took my chances with this one. I’m glad I did. This is a great alternative to buying new pods because those pods are expensive. Compared to other options though, this one seems to be on the more expensive side. Since I haven’t tried any others, I’m not sure if paying a higher price is the best way to go. However, these do work well, and I would recommend them to a friend. Made in China.",71
negative,Lil guy doesn't stand up well. I had to add stronger magnets. But he is cute,71
positive,Part arrived quick and was exactly what I needed to repair my dryer.  Thanks!,71
positive,"[[VIDEOID:c506936a4250cd04e3ed0a8fe7e7767b]] I've been using this for about 5 months now and it works great. Just connect it up to a sink faucet. I bought a $10 wheeled stand at Home Depot so that I can easily store it away. It's a bit confusing at first how to customize the cycles but the way I do it is:<br /><br />1. Plug in<br />2. Load laundry and add detergent on top and close the lid<br />3. Press the power button<br />4. Press Program to go to Gentle mode<br />5. Press load size depending on how much I put in: 1 is the smallest load and three is the largest load. It loops around so keep pressing until you get the number you want.<br />6. Press the Wash button to pick how many minutes each wash will take. This loops around too. I usually pick 8 minutes.<br />7. Press the Rinse button to pick how many rinses to do. This loops around too. I usually just pick 1.<br />8. Then I press the play button to start. With the above settings, the whole wash takes about 24 minutes. If I forgot to put something in while it's going, I press the play button to pause it, open the lid, add the items, close the lid, and click play to continue.<br /><br />I bought a matching electrical dryer: YOLENY Electric Portable Compact Laundry Dryer 1.6 cu.ft, 9 lbs Load Stainless Steel Portable Dryer, 4 Drying Mode, Cold Air Care, for Apartments, White",71
positive,Just exactly what I needed.,71
positive,"The part fit perfectly but the shipping from ups sucks. It came damaged and the 2nd one<br />The box was damaged  but the part was not damaged, it came from the us mail. You may need to package your parts better because of shipping.<br />Thanks",71
negative,"I have no issue with the seller/supplier on this valve assembly, fair price, arrived early and is working. Note: The original factory tape seal on the carton was opened and re taped, so I suspect it was maybe returned at one time and reshipped to me. Regardless, it is working.<br />NOTE: In the assembly process you need to pry out three plastic tubes from the old valve assembly. During this process you will tear up the ends of the old tubes, could cause a leak when reinstalled. No problem for the two outlets, clear vinyl tubing used (just cut off an inch of the vinyl tubing and push in the tubing). Same as the original.<br />The change I noticed is in the water inlet. The manufacturer is using the connection and loose piece locking device as used for the soft vinyl tubing (the old unit had a solid locking device). ""I hope it holds"". The water inlet tube is a firm gray colored tube with a tapered end, so you cannot cut off the end, plus this tube is a custom length ( I suggest you purchase a new tube, if you are purchasing this valve). Anyway, The tubing was just slightly scared from when removed from the solid locking insert, so I wrapped the tapered end of the tubing with some Teflon tape and pressed in the tube, so far so good. But if it starts to leak  will need to replace this tube.<br />Suggestion to the sell of the valve assembly ""suggest end users to replace the inlet gray plastic tube, when replacing the valve assembly"". Maybe a few bucks more, but could save time and money in the long run.",71
positive,No thank you,71
positive,Works great.  Allows me to run my drier in my basement without having to run the duct to the exterior.,71
positive,Worked great on my 40 year old Whirpool oven,71
negative,"Okay,  3 stars because it does what it promises.  It seems substantial enough, fit and finish are fine, and the door now opens and closes. But...  It opens and closes very loudly!  Imagine the old horror shows on tv, where the crypt opens, squeaking all the way, at full volume.  That!<br />If I had seen that coming, I would have definitely paid the difference for OEM.",71
positive,real deal here too...not some after market knockoff..,71
positive,works perfectly,71
positive,Fits as expected. Easy to change,71
negative,Alright so I had the same failure happen on my Kenmore oven. The part is obviously poorly designed and is a hodge podge of Chinese and American standards.<br /><br />Solution: Remove the handle from the oven. Remove bushings from the handle (Do not strip handle threads!!!). Go buy an M8 (1.25)-40mm machine screw and collar washer from big box store. It'll screw right into place and oddly fits the holes in the oven perfectly. You may have to widen the plastic holes. I used a 19/64 bit,71
negative,Not well made. Face comes off during use. Lint drawer opens from heat also.,71
positive,I'm so glad my dishwasher doesn't make a clunking sound anymore. Pretty easy to install. I don't even know how the last tenant managed to lose two bottom rack wheels.,71
positive,Worked well. It definitely made my washer more quiet but it’s older and very loud so not the total quiet I was hoping for but still an improvement. I would recommend.,71
positive,So far they are working great.  I put them in by myself but it would have easier with someone the help,71
positive,Perfect fit...,71
positive,My Samsung dryer wasn't heating. The appliance store here wanted 100 bucks to replace the part. I did some searching and found this part for 20 dollars. Youtubed how to fix it and 40 minutes later the dryer was back to working like new. Saved me a bunch of money and if you can use a screw driver (or drill) and can put things back together you will save yourself some money. Thank goodness!! Highly recommend going this route.,71
