sentiment,text,data_id
negative,"I have never had an upright freezer (and I've had many over the years) that went out in less than 5 years.  On this one, both the condenser and the evaporator were dead and needed to be replaced.  I was told, over the phone, that my warranty was good for 5 years.  The repair company (who they recommended) called them and got the okay to come out to see what was wrong.  When they called in for the fix, they were told that the Frigidaire freezer was not under warranty.  After many phone calls, I found out that the warranty doesn't stay with the freezer. Since it was in the home that I purchased, the warranty was no longer any good.  The first person I spoke with had made a mistake.  So I ended up having to pay a $70 service call fee and now I have to worry about how to get rid of this worthless freezer.  I will never buy any product made by Frigidaire again, and I would strongly advise anyone thinking about it, to choose a product that (1) will last and (2) will honor its warranties.",71
positive,"I like the filter but am very unhappy with the description that Amazon uses. The pitcher shows three filter and shows the price per item as 18.99/6.33ea. That would be the price per item if it was 3 filters, instead it is only two filters for $18.99. It says two pack in written description but the rest of the it is deceptive. Not a good business practice AMAZON!!!!!!",71
positive,"It's a little plastic product, and unfortunately because of it's design, the stress of constantly turning it, means they only last so long.  But Amazon delivered the product quickly, they're inexpensive so I ordered extras.  Poor design, but good customer service and I'm pleased that they offer cheep replacement parts.",71
positive,Oven igniter was clicking but only occasionally lighting. This fixed it right away.,71
positive,Exact match. Hope it lasts,71
positive,Great filter for the price.,71
positive,"Good product, I am happy with it.<br />Came on time. Exactly as described",71
positive,"Replaced the Original Part, and runs good",71
positive,Plug and play replacement part. Made me the hero to my family for fixing the fart fan.,71
positive,"Product delivered as scheduled, cost was affordable and fits my refrigerator.",71
positive,"The delivery and packaging were great.  I love that it's stainless, but it is slower than most of the plastic cups i have.",71
positive,"I had my doubts that the water would not taste good, but it tastes great! And what a great value it is compared to the name brand.",71
positive,Color stayed much longer!,71
positive,This was the part we needed to fix washer,71
positive,Worked perfectly and easy to install,71
positive,This is perfect and will last a long time.,71
positive,Nice replacement part - time will tell how durable it is.,71
positive,Great price for awesome filters!,71
positive,What’s easy to install.<br />Instructions were easy to understand.,71
positive,"These filters are inexpensive, four for $25.00.<br />I installed this filter over a month ago.  The water taste great.  They are easy to install.  Pull the refrigerator out and cut off the water valve before you start.",71
positive,"I have been looking and looking for these counter gap covers. I did a search on Amazon not knowing what in the world to call them BUT they popped up with my crazy name. I needed black so I was really happy.  I measured the area to be protected and the 21” was perfect. There is a 25” gap cover as well. I didn’t need to do a custom cut or do anything. The fit is perfect and lays nice and flat and cleans up beautifully. There are two in the pack which was great. I only need one. Thus, I have a spare. These are a great product and I highly recommend purchasing them. They are top quality.",71
positive,Fits perfect,71
negative,Do not buy. Quit working after 2 weeks. To much hassle to return.,71
positive,Very fast and as described.,71
positive,Good replacement for refrigerator,71
negative,Cant use only got sack no product sack was empty<br />No seal on the open end !!!!!,71
positive,Exact fit and it works.,71
positive,Make sure your exhaust fan is coming out of the top I messed up and forgot to check that. But everything about it is great,71
negative,It is not 'officially' recognized by my 2.0 Keurig coffee brewer. You have to trick it by moving the icon from an old coffee pot to this.,71
positive,Great.  Thank you,71
negative,Gift for my daughter who raises chickens ... saves space in her fridge!  Only problem was a small crack in one corner which causes no problem.,71
positive,"Me gustan mucho, son fáciles de instalar.",71
positive,"This tool is very handy to have especially in situations where knowing the accurate temperature and humidity is crucial I highly recommend this product seems to be made out of quality material and it has a really nice LCD screen on it, easy push button features and it even comes with its own batteries and has a caring sleeve for storage.",71
positive,"Because we found ourselves members of so many local winery “club shipments” my wife and I decided it was time to have an appropriate way to store our purchases and we are so happy we finally splurged on this wine cooler! Previously we would have to go to the cabinet (or usually the garage or laundry room) and grab a bottle to throw in the freezer, where we would have to wait and usually forget it, each time we wanted to open a bottle - but now we have our favorites ready to be enjoyed any time we want! We love that the wooden trays pull out so we can see what kind of wine it is without having to pull each bottle out individually, and we can even store larger bottles like champagne at the bottom so we are always ready to celebrate. It’s super quiet - so much so that at first my wife would feel the door when she walked by just to make sure it was on but the temperature always matched exactly what the digital display was set to! This was a great purchase and has really elevated our home and our life - with so much going wrong in the world this is a bright spot that makes things very right! Be warned though, this comes in a very big box and is very heavy - but it’s incredibly intuitively easy to setup and you can reward yourself with some perfectly cooled wine after you’ve gotten it in just the right spot.",71
positive,"Good quality, fits as expected!",71
positive,"Esta bueno, podes hacer un rico cafe, después de utilizar gotea.",71
positive,Perfect door hamdles,71
positive,Great product. I live in my RV and this ice maker is a workhorse in providing my ice needs.,71
negative,"The K-Cups are really nice. I was very excited to get them so I can brew my own coffee and save money and most importantly environment! However there is a problem - no matter what kind coffee you put in these cups it taste like crap. I would not recommend to use these, I guess the coffee Keurig puts in their cups is different concentration or something. So I would not recommend it.",71
positive,"Perfect fit, washing machine is back in action!",71
positive,This is a great little coffee maker. My son loved it. I would buy another. Good quality and it came fast.,71
positive,A bit of advice....Buy the idler wheel sets that include the small shafts as well. These aftermarket wheels don't always fit well on the original shafts and they rarely fit well on other aftermarket shafts if they have been previously replaced. That being said these replacement kits are a very good value when you consider the cost of a new dryer.,71
positive,Much needed item,71
negative,Dont buy,71
positive,"These are exactly what I was looking for.  Can't honestly say how heat resistant they are because the burners haven't been turned up to a temp where I'd be able to say how they've held up.  It's not an issue, but these are not a snug fit.  They simply slide into the space between stove and cabinetry, preventing spills and crumbs from coating the side of kitchen cabinets.  That's all I need it to do, but some might be disappointed that it's not a tighter fit.  Length was perfect for our stove and they've already proven useful.  Having had to pull the stove out recently and clean out all the nastiness on the side of the cabinetry and behind the oven, these will work well to prevent a repeat.  Shipping was fast, and unlike some other reviews, ours were folded over, but straightened out nicely without any folds.  Happy with the purchase!",71
positive,What can I say They have coffee filters that fit my coffee pot fine,71
positive,Easy to install was hard to find but it was here on Amazon,71
negative,Got this and was super excited to use this. It was a disappointment.. it barely allows for any suction from the vacuum. And the tube is so tiny that it kept getting clogged every 5 seconds.,71
positive,These extenders look great. They blend right in with a nice counter-top. They are just the right size to look neat. The magnetic sides grip right to the range for a perfect fit. I'm very please with the crumb drop protection they give and the finished look.,71
positive,I was skeptical as it has been awhile (years :)) since we had a filter.  It was easy to set up & use.  Most surprising is the coffee & tea tastes better!  Great choice.,71
positive,"My dishwasher is Kitchenaid model# KUDA03CTBS3 (EXACT FIT NO MODIFICATION).<br />came in 2 days ( IT IS OEM PART).<br />Came in whirlpool bag. (Exact length as ogrinal ones). Pulled dishwasher out 1/2 way, wire & flex water line should be long enough, mine were. Replaced both plastic rollers (in same location) (and yes both wheels do spin on both sides) attatch strings and your done. No noise whatsoever.",71
positive,"Apenas tengo unos 3 días usándolo me parece que es bien bonito, va muy bien combinado con mi estufa, en cuando a la succión puedo ver que hace muy buen trabajo, el ruido pues no es tan silencioso pero no me molesta, mi esposo me dijo que fue algo difícil de instalar pero lo pudo hacer perfectamente bien con ayuda de su papá, así que pues estoy muy encantada!!",71
positive,Great replacement refrigerator water filter for any fridge requiring the twist lock 96-9006 type filter.<br />One filter lasted just about 1 year of normal water/ice cube usage for a family of 3-4!<br /><br />Water tasted great!,71
positive,does what is says. good price,71
positive,Using these has really helped with food falling between the counter and stove!,71
positive,Works very well with my Samsung fridge,71
negative,"Well, it’s cardboard, so how hard can it be?",71
positive,"These reusable k-cups work great in the Keurig we have at work. I especially like that a &#34;freedom clip&#34; is included in the box, should you have the extremely lame series of keurig that only accepts &#34;genuine&#34; k-cups. 10/10 would buy again.",71
negative,We have been using this item for years and it is important to find it available from a reliable source.,71
positive,Easy to install and works like it should,71
positive,Does the job some of the clips was a little to short but I used the old ones and made it work.,71
positive,Good quality for the money!,71
positive,"Such a luxury item for us but, we use it daily and It gave us back half of our freezer space. It works fast and without any complaints from us.",71
negative,Bought  as a gift for my mother. They do look nice.<br />Will up date in a bit.<br />12/8/18 update<br />I coucld not figure out how to use them.  I get sn oops msg or a drop of coffee comes out.,71
positive,I didn't realize how long it took my old filament to bring the oven up to temperature. This new one cut the time to a third. Very nice.,71
negative,Doesn’t slope enough for eggs to stay forward.,71
positive,THE UNIT WAS DELIVERED WITHOUT PROBLEM. IT WAS FAIRLY EASY TO INSTALL. THE FAN WHEN ACCELERATING SPEED AND WHEN DECLERATING HIT THE HOUSING AND KNOCKED.SINCE IT WAS INSTALLED AND RUNNING FINE OTHERWISE WE DECIDED TO SEE IF IT WOULD STOP KNOCKING AFTER A LITTLE USE. IT HAS AND OPERATES GREAT WE ARE COMPLETELY SATISFIED.,71
positive,Comes with a nifty little tool to make filling the capsules easy peasy.,71
negative,"2/10/21 : BUYER BEWARE! The website states this filter is compatible with the Samsung  ""HAFIN1/EXP"" filter, IT DOES NOT!  It is (only) compatible with a Samsung [HAFIN2/EXP] filter, as stated on the box. Deceptive/incorrect product description. If you own a Samsung, ""double door"" refrigerator, (purchased 20/14 to 20/17), and specifically - Samsung model No: RS22HDHPNBC/AA, this filter WILL NOT FIT! PERIOD! Save your money & time, as you'll be returning it, as I did!",71
positive,Just the right size and handle length for what I need it for. I wanted something that would froth milk for cappuccinos. This is working out just great. The handle doesn't get hot and the bowl doesn't overflow with foam. Good price also.,71
positive,Love these filters. No mud in the bottom of my cup anymore.,71
positive,Runs like a charm! Tried local businesses but this company found the right match the first time!,71
positive,Exact replacement of my old one works great. Probably need a drill when installing.,71
positive,"I like the storage capacity, but wish it could store 30. I usually buy a 30 plus pack of eggs. I had to buy 2 but they take up space in the fridge. Otherwise very neat",71
positive,Perfect size and easy to handle and clean.,71
positive,"I bought this washer after reading the many positive reviews at multiple sites . I am replacing a ten year old popular brand front loading washer that many of us have come to expect tens of years from. As you can see I will not be buying that brand anymore. The washer has plenty of features but the one I was most interested in is the perfect spin which works as advertised. This is what killed my old washer. This washer is hands down a better washer. It can complete a wash in as little as eighteen minutes and my clothes do not have a musty smell to them, my old washer always left a musty smell. I also have noticed that there is near zero lint in my dryer lint trap. I have owned this washer for just under three months. With that said, my expectations are high. I would  recommend this washer to anybody.",71
positive,Stove looks  brand new  no issues fit is perfect,71
negative,"Nicely designed hood but they need to work on quality control. The sheetmetal plenum that the fan sits in was spotwelded slightly off center so the fan rubbed and made a racket when I first installed it. Being an engineer I am inclined to fix things myself and was able to modify the motor bracket to shift the fan over a bit to clear. I know 99% of people would not have done this but hopefully I just got the 1 hood that slipped through QC (if they did any). The sad part about this is that this hood is actually made in the USA...I would have expected this sort of quality problem from an offshore manufacturer! Would have probably given 5 stars if the housing had not been welded improperly as it is otherwise a good hood.<br /><br />One the hood was fixed it does run well, is pretty quiet (some whine from the motor at low speed) and produces a hurricane at high speed. Wish the front vent for ductless operation angled the airflow up a bit so it didn't blow in your face when you are standing in front of the range. I do like the continuously variable speed control vs. most hi/lo/off controls.<br /><br />The black wires (line) could have been another 2 or so longer for slightly easier wiring.<br /><br />Black finish looked very good.<br /><br />Shipped quickly and replacement filters were fairly priced. Much better price online than they wanted at local H-D & Lowes",71
positive,it was exactly as advertised,71
negative,"A lot of play, not a snug fit, indicator arrow/mark doesn’t line up with drying times.  A waste of money.",71
positive,Love it n best price,71
positive,Dryer runs and sounds like me!,71
positive,"After getting a higher end wok, I was disappointed to realize that the rounded bottom definitely needed a wok ring to support it securely on my Fridgedaire professional series gas stove. I did NOT want to spend much on one though so after spending quite a bit of time searching the net, this one was cautiously purchased with fingers crossed that it would fit. And it does! It has 4 notches that easily attach to the stove top, so much so that I do not even have to look when I put it on. It is a solid cast iron, so must cool well before you can touch or put it away. I oil it lightly when I oil the wok to keep it from rusting, This ring will last forever. It should easily fit any stove top - gas or electric- and any type of round bottom wok.",71
positive,Received the part quickly and it was installed by my handyman immediately.  Washer working!  Thanks,71
positive,"Wow!  This is not only a beautiful appliance, but it works incredible.  My wife absolutely loves it.",71
positive,"Works perfect. Ice and water taste fresh. Very easy to install, just line up arrows",71
positive,Fits fine,71
positive,Fit like they were supposed to and work as stated. Had a no heat issue and decided to replace all 3. Worth the cost.,71
positive,As expected.,71
negative,Stopped working less than 2 years after we bought it,71
positive,This is exactly what we were looking for to seal the gap between our countertop and the stove.  No more dripping grease or crumbs down the side of the stove!  Perfect for the job!,71
positive,It’s a good product it’s medium size the spinner doesent dry a lot but enough to not leave the clothes soaking wet. Wish the draining cord would be alittle bit longer but the rest works wonders ✨🙌🏼,71
positive,Good value for the mi ey,71
positive,"I bought this product at the request of another person. But I can say That the delivery was on time, he bought because he liked the price and I think he liked the product.",71
positive,"I replaced bad rollers about 8 months ago but apparently I got a bad set because within a week the dryer started to make more noise than normal, unfortunately I am gone a lot for work and kids continued using, fortunately the updated belt wich is a lot thicker and the new rollers have made my dryer quiet again but time will tell",71
positive,Fast service and a great price.,71
positive,Perfect fit with all parts needed for tube replacement.,71
positive,Easy to install and works perfect!,71
positive,I didn't realize there are different size filters. These are too big for my Cuisinart K-Cup coffee maker. I should have checked sizes but they are the same shape and since my machine is newer than 2007 I thought they'd work.,71
positive,I love this thing.,71
positive,"Make sure you buy the correct tube for the correct burner, the are different lengths and bent in different directions.",71
positive,Great value for 2 and did not have any problems using/installing them.,71
positive,This makes me so happy to find my product in bulk packaging.  I don't like having to order every six months and end up pay more.  The 3 pack will save me money.,71
positive,Just like the one that came with my fridge when it was new.,71
positive,It came fast and fits perfectly.,71
positive,Love trying different fresh ground coffee and this works like a charm.,71
positive,"Although a little different handle, this lint trap fit perfectly.",71
positive,Tastes very good.,71
positive,Fits Frigidaire perfectly,71
positive, ,71
negative,"According to specs. with product, you're actually advised not to expect accurate humidity readings.<br /><br />This is a very poor quality piece of junk!!",71
negative,Should have come in spry bottles.  Not easy to use.,71
positive,These reusable cups are a must. Work exceptionally well for a perfect cup of coffee every time 😊<br /><br />Works really well In our mini Keurig !,71
positive,Exactly what is was intended for,71
positive,THIS IS AMAZING-ALL THE FRONT WHEELS ON THE TRAY IN MY DISHWASHER HAD BROKEN AND I WAS SO UPSET I WAS GOING TO BUY A NEW DISHWASHER BUT I SAW THIS ON AMAZON AND DECIDED TO GET THEM AND HOW EXCITING I CAN NOW PULL THE TRAIN IN AND OUT AGAIN-IT IS LIKE HAVE A BRAND NEW DISHWASHER AGAIN,71
negative,"This ice maker probably would have worked (It is exactly the same as the one I ended up buying.), but I was put off because the particular adapter I needed arrived broken.",71
negative,No ice after 2 weeks,71
negative,"Unfortunately I received two strips with completely different finishes. One strip was matte and the other was shiny. Both seem to attract all the crumbs possible. Loved the concept, hate the material.",71
negative,I thought my refrigerator was broken. I tried both filters for over a week. It took almost a minute to get 8 ounces of water out. Not worth the money. Bought a certified filter and no problems now.,71
negative,"Don’t waste your money. Tried to save a few bucks over the other ones I had but totally regretted it. These cut my water flow rate to a trickle. I seriously think I grew a year older just waiting for a water bottle to fill up. PASS. Called and got a refund. I reordered these, highly recommend:<br />ICEPURE UKF8001 Replacement Whirlpool Filter 4, Everydrop EDR4RXD1, FMM-2, Maytag UKF8001AXX-200, 9084, 4396395, MPF15090, WF-UKF8001,WF295,SGF-M9,Puriclean II,RWF0900A Refrigerator Water Filter,2PACK https://www.amazon.com/dp/B00ZYDKI1Y/ref=cm_sw_r_cp_api_i_SSa8Eb2Q2PG9D",71
positive,This is a good replacement part,71
positive,Photo of old solenoid in place. New part works great! Shipped promptly. Thank you,71
positive,Arrived in same type of cardboard and foam packaging as previously purchased from the manufacturer.  Came with thick insulating sleeves over the wires.  I was able to splice in this broiler igniter using ceramic wire connectors to avoid removal of wall oven (it's a beast).,71
positive,The price was great,71
positive,The fridge still works,71
positive,Fit great in fridge,71
positive,Can't say much more about filters than I received them and will use them when needed. I received them on time and in a box with my refrigerator water filter. They were packed well and were the items that I had ordered.,71
negative,Product works and looks fine but did not fit the Maytag Gemini.  I had to grind down the notch that is supposed to fit into the groove opposite the piece that plugs into the stove. Very annoying but better than sending back and starting from scratch trying to find one that fits correctly.,71
positive,Did what it was supposed to do. It was a good deal,71
positive,"It's a vent cover. Kind of flimsy, but they all are. Not sure why HD or Lowes doesn't sell this size, but every house in my neighborhood uses this size. Fits a 6&#34; pipe. Prompt delivery.<br />Edit, June 1, 2019:<br />Buying a second one for the other vent, holding up well & hasn't discolored or cracked.",71
negative,Coffee grounds get past this filter.,71
positive,"Good and convenient product, at a good price.  And the coffee tastes better than paper filtered coffee",71
positive,Needed the refill(s) for our humidifier and they worked well!,71
positive,Lasted 2 years,71
positive,It's works better than I could have expected. I love it and it doesn't take up a lot of room.,71
positive,"Product came fast, was initially missing one piece to the kit.  5 minute phone call to amazon had that corrected in a flash and they overnighted me a new one for free.  When it arrived, everything was super easy to install, dryer is not screaming at me anymore and I saved over 150 bucks by installing myself.",71
positive,Works as advertised.,71
positive,Works fine.,71
negative,"I'm sure it would have worked great, but we didn't end up needing it and customer service was terrible to work with in regards to sending it back.<br /><br />If anyone needs one, we still have it!! It's brand new, in great condition and we would be happy to sell it to you for a little under what we paid for.",71
positive,"Purchased one and it arrived with a crack in the lid under the label. Purchased a second one. I thought it came fully intact, but had a minor chip in the egg well area. I kept it as it was too much of a hassle to return after washing and drying for first use. I would recommend fully inspecting before washing and first use. Otherwise, I really like the product and to be able to see how many eggs are left in the fridge is a plus.",71
negative,Ordered this item 2 times & had to send it back both times due to damage upon arrival! Broken plastic peices fell out of box when opened.,71
positive,Perfect fit to replace one i lost for my Solofill,71
positive,Looks very sleek and modern. Would recommend,71
negative,"Parts quit working within a few days , waste of money 💰",71
positive,Dryer was squeaking terribly -- took less than an hour to get it installed and dryer sounds like a new machine and everyone is glad that the squeak is gone,71
negative,"Did not fit my 2.0. Was too tall, so I had it picked up for return. Over a month and a half later, still no refund.",71
positive,My friend and I repaired my friend's dryer. Please note the blower would not come off the old motor shaft (left-handed thread and all) So just order the motor (Frigidaire 131560100) along with this blower. Don't forget to save the thermistor out of the old blower. good luck!,71
negative,"Easier to use than the Keurig version that requires you to take out a piece of the machine.  However, you can't put much in for coffee grounds without it overflowing.  Doesn't appear to have a very good seal at the top where the water is injected into the pod by the machine.",71
positive,THIS IS A REGRIGERATOR WATER FILTER. MATCHING THE RIGHT MANUFACTURERS NUMBERS AND TYPE OF REGRIG. TO THE FILTER WAS VERY CONFUSING!,71
positive,works,71
negative,It’s okay,71
positive,Exelente protector,71
positive,works,71
positive,Absolutely love this machine! Perfect for my needs!!,71
positive,Just as described and fast ship! Thanks!,71
positive,Great product . easy install. But seem to have to by 1 or 2 each year,71
